{
  "$schema": "https://json-schema.org/draft/2020-12/schema",
  "type": "object",
  "properties": {
    "format": {
      "type": "string",
      "const": "opencontext-vault-export"
    },
    "version": {
      "type": "number",
      "const": 1
    },
    "exportedAt": {
      "type": "string",
      "format": "date-time",
      "pattern": "^(?:(?:\\d\\d[2468][048]|\\d\\d[13579][26]|\\d\\d0[48]|[02468][048]00|[13579][26]00)-02-29|\\d{4}-(?:(?:0[13578]|1[02])-(?:0[1-9]|[12]\\d|3[01])|(?:0[469]|11)-(?:0[1-9]|[12]\\d|30)|(?:02)-(?:0[1-9]|1\\d|2[0-8])))T(?:(?:[01]\\d|2[0-3]):[0-5]\\d:[0-5]\\d(?:\\.\\d+)?(?:Z|([+-](?:[01]\\d|2[0-3]):[0-5]\\d)))$"
    },
    "vaultId": {
      "type": "string"
    },
    "generator": {
      "type": "string"
    },
    "memories": {
      "type": "array",
      "items": {
        "type": "object",
        "properties": {
          "id": {
            "type": "string",
            "pattern": "^mem_[0-9a-f]{16}$"
          },
          "kind": {
            "type": "string",
            "enum": [
              "fact",
              "preference",
              "skill",
              "goal",
              "relationship",
              "event",
              "instruction"
            ]
          },
          "statement": {
            "type": "string",
            "minLength": 1,
            "maxLength": 500,
            "pattern": "^[^\\n\\r]*$"
          },
          "subject": {
            "type": "string",
            "minLength": 1,
            "maxLength": 80
          },
          "tags": {
            "maxItems": 10,
            "type": "array",
            "items": {
              "type": "string",
              "pattern": "^[a-z0-9][a-z0-9_.:-]{0,39}$"
            }
          },
          "confidence": {
            "type": "string",
            "enum": [
              "stated",
              "inferred"
            ]
          },
          "validFrom": {
            "type": "string",
            "format": "date-time",
            "pattern": "^(?:(?:\\d\\d[2468][048]|\\d\\d[13579][26]|\\d\\d0[48]|[02468][048]00|[13579][26]00)-02-29|\\d{4}-(?:(?:0[13578]|1[02])-(?:0[1-9]|[12]\\d|3[01])|(?:0[469]|11)-(?:0[1-9]|[12]\\d|30)|(?:02)-(?:0[1-9]|1\\d|2[0-8])))T(?:(?:[01]\\d|2[0-3]):[0-5]\\d:[0-5]\\d(?:\\.\\d+)?(?:Z|([+-](?:[01]\\d|2[0-3]):[0-5]\\d)))$"
          },
          "validUntil": {
            "type": "string",
            "format": "date-time",
            "pattern": "^(?:(?:\\d\\d[2468][048]|\\d\\d[13579][26]|\\d\\d0[48]|[02468][048]00|[13579][26]00)-02-29|\\d{4}-(?:(?:0[13578]|1[02])-(?:0[1-9]|[12]\\d|3[01])|(?:0[469]|11)-(?:0[1-9]|[12]\\d|30)|(?:02)-(?:0[1-9]|1\\d|2[0-8])))T(?:(?:[01]\\d|2[0-3]):[0-5]\\d:[0-5]\\d(?:\\.\\d+)?(?:Z|([+-](?:[01]\\d|2[0-3]):[0-5]\\d)))$"
          },
          "sources": {
            "maxItems": 20,
            "type": "array",
            "items": {
              "type": "object",
              "properties": {
                "sourceId": {
                  "type": "string",
                  "pattern": "^src_[0-9a-f]{16}$"
                },
                "turn": {
                  "type": "integer",
                  "minimum": 0,
                  "maximum": 9007199254740991
                },
                "quote": {
                  "type": "string",
                  "minLength": 1,
                  "maxLength": 500
                },
                "verified": {
                  "type": "boolean"
                }
              },
              "required": [
                "sourceId",
                "verified"
              ],
              "additionalProperties": false
            }
          },
          "createdAt": {
            "type": "string",
            "format": "date-time",
            "pattern": "^(?:(?:\\d\\d[2468][048]|\\d\\d[13579][26]|\\d\\d0[48]|[02468][048]00|[13579][26]00)-02-29|\\d{4}-(?:(?:0[13578]|1[02])-(?:0[1-9]|[12]\\d|3[01])|(?:0[469]|11)-(?:0[1-9]|[12]\\d|30)|(?:02)-(?:0[1-9]|1\\d|2[0-8])))T(?:(?:[01]\\d|2[0-3]):[0-5]\\d:[0-5]\\d(?:\\.\\d+)?(?:Z|([+-](?:[01]\\d|2[0-3]):[0-5]\\d)))$"
          },
          "updatedAt": {
            "type": "string",
            "format": "date-time",
            "pattern": "^(?:(?:\\d\\d[2468][048]|\\d\\d[13579][26]|\\d\\d0[48]|[02468][048]00|[13579][26]00)-02-29|\\d{4}-(?:(?:0[13578]|1[02])-(?:0[1-9]|[12]\\d|3[01])|(?:0[469]|11)-(?:0[1-9]|[12]\\d|30)|(?:02)-(?:0[1-9]|1\\d|2[0-8])))T(?:(?:[01]\\d|2[0-3]):[0-5]\\d:[0-5]\\d(?:\\.\\d+)?(?:Z|([+-](?:[01]\\d|2[0-3]):[0-5]\\d)))$"
          },
          "createdBy": {
            "type": "string",
            "minLength": 1,
            "maxLength": 80
          },
          "status": {
            "type": "string",
            "enum": [
              "active",
              "superseded"
            ]
          },
          "supersedes": {
            "type": "string",
            "pattern": "^mem_[0-9a-f]{16}$"
          },
          "supersededBy": {
            "type": "string",
            "pattern": "^mem_[0-9a-f]{16}$"
          }
        },
        "required": [
          "id",
          "kind",
          "statement",
          "subject",
          "tags",
          "confidence",
          "sources",
          "createdAt",
          "updatedAt",
          "createdBy",
          "status"
        ],
        "additionalProperties": false
      }
    },
    "sources": {
      "type": "array",
      "items": {
        "type": "object",
        "properties": {
          "id": {
            "type": "string",
            "pattern": "^src_[0-9a-f]{16}$"
          },
          "type": {
            "type": "string",
            "enum": [
              "chatgpt",
              "claude",
              "gemini",
              "markdown",
              "text",
              "agent",
              "vault"
            ]
          },
          "kind": {
            "type": "string",
            "enum": [
              "conversation",
              "document"
            ]
          },
          "title": {
            "type": "string",
            "minLength": 1,
            "maxLength": 300
          },
          "origin": {
            "type": "object",
            "properties": {
              "importer": {
                "type": "string",
                "minLength": 1
              },
              "path": {
                "type": "string"
              },
              "externalId": {
                "type": "string",
                "minLength": 1
              },
              "trust": {
                "type": "string",
                "enum": [
                  "imported",
                  "agent-supplied"
                ]
              }
            },
            "required": [
              "importer",
              "path",
              "externalId",
              "trust"
            ],
            "additionalProperties": false
          },
          "tags": {
            "maxItems": 10,
            "type": "array",
            "items": {
              "type": "string",
              "pattern": "^[a-z0-9][a-z0-9_.:-]{0,39}$"
            }
          },
          "createdAt": {
            "type": "string",
            "format": "date-time",
            "pattern": "^(?:(?:\\d\\d[2468][048]|\\d\\d[13579][26]|\\d\\d0[48]|[02468][048]00|[13579][26]00)-02-29|\\d{4}-(?:(?:0[13578]|1[02])-(?:0[1-9]|[12]\\d|3[01])|(?:0[469]|11)-(?:0[1-9]|[12]\\d|30)|(?:02)-(?:0[1-9]|1\\d|2[0-8])))T(?:(?:[01]\\d|2[0-3]):[0-5]\\d:[0-5]\\d(?:\\.\\d+)?(?:Z|([+-](?:[01]\\d|2[0-3]):[0-5]\\d)))$"
          },
          "importedAt": {
            "type": "string",
            "format": "date-time",
            "pattern": "^(?:(?:\\d\\d[2468][048]|\\d\\d[13579][26]|\\d\\d0[48]|[02468][048]00|[13579][26]00)-02-29|\\d{4}-(?:(?:0[13578]|1[02])-(?:0[1-9]|[12]\\d|3[01])|(?:0[469]|11)-(?:0[1-9]|[12]\\d|30)|(?:02)-(?:0[1-9]|1\\d|2[0-8])))T(?:(?:[01]\\d|2[0-3]):[0-5]\\d:[0-5]\\d(?:\\.\\d+)?(?:Z|([+-](?:[01]\\d|2[0-3]):[0-5]\\d)))$"
          },
          "sha256": {
            "type": "string",
            "pattern": "^[0-9a-f]{64}$"
          },
          "bytes": {
            "type": "integer",
            "minimum": 0,
            "maximum": 9007199254740991
          },
          "turnCount": {
            "type": "integer",
            "minimum": 0,
            "maximum": 9007199254740991
          },
          "hasRaw": {
            "type": "boolean"
          },
          "notes": {
            "type": "array",
            "items": {
              "type": "string"
            }
          },
          "review": {
            "type": "object",
            "properties": {
              "status": {
                "type": "string",
                "enum": [
                  "unreviewed",
                  "reviewed",
                  "skipped"
                ]
              },
              "at": {
                "type": "string",
                "format": "date-time",
                "pattern": "^(?:(?:\\d\\d[2468][048]|\\d\\d[13579][26]|\\d\\d0[48]|[02468][048]00|[13579][26]00)-02-29|\\d{4}-(?:(?:0[13578]|1[02])-(?:0[1-9]|[12]\\d|3[01])|(?:0[469]|11)-(?:0[1-9]|[12]\\d|30)|(?:02)-(?:0[1-9]|1\\d|2[0-8])))T(?:(?:[01]\\d|2[0-3]):[0-5]\\d:[0-5]\\d(?:\\.\\d+)?(?:Z|([+-](?:[01]\\d|2[0-3]):[0-5]\\d)))$"
              },
              "by": {
                "type": "string"
              },
              "memoriesCreated": {
                "type": "integer",
                "minimum": 0,
                "maximum": 9007199254740991
              },
              "note": {
                "type": "string",
                "maxLength": 500
              }
            },
            "required": [
              "status"
            ],
            "additionalProperties": false
          },
          "content": {
            "oneOf": [
              {
                "type": "object",
                "properties": {
                  "kind": {
                    "type": "string",
                    "const": "conversation"
                  },
                  "turns": {
                    "type": "array",
                    "items": {
                      "type": "object",
                      "properties": {
                        "i": {
                          "type": "integer",
                          "minimum": 0,
                          "maximum": 9007199254740991
                        },
                        "role": {
                          "type": "string",
                          "enum": [
                            "user",
                            "assistant",
                            "system",
                            "tool"
                          ]
                        },
                        "text": {
                          "type": "string"
                        },
                        "at": {
                          "type": "string",
                          "format": "date-time",
                          "pattern": "^(?:(?:\\d\\d[2468][048]|\\d\\d[13579][26]|\\d\\d0[48]|[02468][048]00|[13579][26]00)-02-29|\\d{4}-(?:(?:0[13578]|1[02])-(?:0[1-9]|[12]\\d|3[01])|(?:0[469]|11)-(?:0[1-9]|[12]\\d|30)|(?:02)-(?:0[1-9]|1\\d|2[0-8])))T(?:(?:[01]\\d|2[0-3]):[0-5]\\d:[0-5]\\d(?:\\.\\d+)?(?:Z|([+-](?:[01]\\d|2[0-3]):[0-5]\\d)))$"
                        },
                        "omitted": {
                          "type": "array",
                          "items": {
                            "type": "string"
                          }
                        }
                      },
                      "required": [
                        "i",
                        "role",
                        "text"
                      ],
                      "additionalProperties": false
                    }
                  },
                  "raw": {}
                },
                "required": [
                  "kind",
                  "turns"
                ],
                "additionalProperties": false
              },
              {
                "type": "object",
                "properties": {
                  "kind": {
                    "type": "string",
                    "const": "document"
                  },
                  "mediaType": {
                    "type": "string",
                    "enum": [
                      "text/markdown",
                      "text/plain"
                    ]
                  },
                  "text": {
                    "type": "string"
                  },
                  "raw": {}
                },
                "required": [
                  "kind",
                  "mediaType",
                  "text"
                ],
                "additionalProperties": false
              }
            ]
          }
        },
        "required": [
          "id",
          "type",
          "kind",
          "title",
          "origin",
          "tags",
          "createdAt",
          "importedAt",
          "sha256",
          "bytes",
          "turnCount",
          "hasRaw",
          "notes",
          "review",
          "content"
        ],
        "additionalProperties": false
      }
    }
  },
  "required": [
    "format",
    "version",
    "exportedAt",
    "vaultId",
    "generator",
    "memories",
    "sources"
  ],
  "additionalProperties": false
}
